{
  "manifest_schema_version": "0.1",
  "dataset_version": "0.1",
  "business_logic_version": "1.2",
  "ai_contract_version": "0.1.2",
  "ai_scope_version": "0.1",
  "frozen_reference_sha": "55fb28a7c0660462e5842e2eb5c71cfa763e5801",
  "created_at": "2026-09-29T22:51:12+08:00",
  "status": "frozen",
  "example_only": false,
  "scenario_count": 54,
  "scenario_family_count": 54,
  "sample_count": 250,
  "split_policy": {
    "assignment_unit": "scenario_family",
    "target_percentages": {
      "train": 70,
      "validation": 10,
      "test": 15,
      "hard_test": 5
    },
    "final_split_assigned": true
  },
  "split_statistics": {
    "train": 171,
    "validation": 24,
    "test": 37,
    "hard_test": 12,
    "unassigned": 6
  },
  "task_statistics": {
    "parameter_extraction": 17,
    "proposal_generation": 31,
    "clarification": 45,
    "tool_call": 22,
    "result_explanation": 25,
    "ui_context_reasoning": 14,
    "entity_resolution": 14,
    "interaction_context_reasoning": 17,
    "conversation_context_reasoning": 14,
    "intent_classification": 6,
    "rule_qa": 21,
    "error_handling": 18,
    "unsupported_detection": 6
  },
  "scope_statistics": {
    "CORE": 211,
    "SUPPORTED_BUT_GATED": 39,
    "DEFERRED": 0
  },
  "source_statistics": {
    "manual": 95,
    "teacher_generated": 155
  },
  "trust_statistics": {
    "GOLD": 95,
    "SILVER": 155,
    "SYNTHETIC_UNVERIFIED": 0
  },
  "difficulty_statistics": {
    "easy": 28,
    "normal": 137,
    "hard": 79,
    "ood": 6
  },
  "lifecycle_statistics": {
    "draft": 0,
    "generated": 0,
    "validated": 0,
    "reviewed": 0,
    "approved": 250,
    "rejected": 0,
    "deprecated": 0
  },
  "artifacts": [
    {
      "kind": "scenario",
      "path": "scenarios.json",
      "record_count": 54,
      "sha256": "b4ba7f406f017cd28c7c6885827717ae246b8f4dfb794a76fe00db5f9db59815"
    },
    {
      "kind": "sample",
      "path": "samples.json",
      "record_count": 250,
      "sha256": "768916c8781dc2608ac8220588a0e85ffc043d8f16a45e9bd3497b87a214e562"
    },
    {
      "kind": "validation_report",
      "path": "split_assignment.json",
      "record_count": 250,
      "sha256": "e3e1599673b3227edeaad3bc62f04e0f3249dd886946f502664428939d8d3765"
    },
    {
      "kind": "validation_report",
      "path": "coverage_report.json",
      "record_count": 1,
      "sha256": "a213bb66a34462921c46cc0f2eecc6ef95722f8b0b53944d862c7b428dfb9672"
    }
  ],
  "validation_summary": {
    "schema_valid": true,
    "contract_valid": true,
    "scope_valid": true,
    "leakage_valid": true,
    "policy_valid": true,
    "privacy_valid": true,
    "error_count": 0,
    "warning_count": 155,
    "report_reference": "docs/ai/dataset/canonical_training/v0.1/coverage_report.json"
  },
  "privacy": {
    "synthetic_identifiers_required": true,
    "production_data_allowed": false,
    "real_personal_data_allowed": false
  },
  "notes": "assembly_mode=canonical_training_v0.1; training_eligible=true; method=sha256_seeded_balanced_swap_annealing_v1; seed=9be1655ffe2c0904fb738c7f5be94e603bcfa3c2f4f71e30c970a9879073404e; freeze_timestamp=2026-09-29T22:51:12+08:00; source_gold_path=docs/ai/dataset/gold_seed/v0.1/p0; source_gold_scenarios_sha256=b4ba7f406f017cd28c7c6885827717ae246b8f4dfb794a76fe00db5f9db59815; source_gold_samples_sha256=34ffd94d9c5ccbb17e6632b8689194c4be53f7275db828e983f6d6540b406dee; source_gold_manifest_sha256=cb0bc5918534aba996383574e1715327730d83bcc64ed57df57a2fb4ddc4e6eb; source_teacher_path=docs/ai/dataset/teacher/v0.1; source_teacher_scenarios_sha256=b4ba7f406f017cd28c7c6885827717ae246b8f4dfb794a76fe00db5f9db59815; source_teacher_samples_sha256=5d2ca222d8ee4a87ae9e17cdaa0dd22dbfa8bf6835458e34e3be6c9292e4c4d9; source_teacher_manifest_sha256=2add79d8111feff4aca4453480cc3380fe0cf81d1ef32f090aee0246bbdf5895; percentages=70/10/15/5; unit=scenario_family_id+split_group_id; pending families=family_ictx_006 remain unassigned under frozen policy; FIN-002 excluded with zero samples; rejected Teacher candidates excluded. Frozen source scenarios remain byte-identical reference snapshots with source split unassigned; assigned sample splits are governed by split_assignment.json. No source Ground Truth, surface, context, trust or Teacher provenance was changed. Corrections require new Canonical Training Dataset version."
}
